{
    "$schema": "https://raw.githubusercontent.com/ianphil/WattsWise/refs/heads/master/schemas/v1/training-schema.json?token=GHSAT0AAAAAAC5MDBYQNTRHDKNKL2P22K36Z45G22Q",
    "context": {
      "TodaysDate": "2025-01-31",
      "periodization": "Base",
      "trainingBlockWeek": "Recovery week 4, day 5 rest day",
      "upcomingRace": {
        "name": "Currahee Gravel 24 miles 3000ft of climbing",
        "date": "2025-05-31",
        "priority": "A"
      }
    },
    "recentWorkouts": {
      "stravaData": {
        "lastWorkout": {
          "date": "2025-01-30",
          "type": "Zone 4 Interval",
          "durationOrDistance": "1 hour",
          "averagePowerOrHR": "205w",
          "rpe": "5",
          "notes": "Indoor"
        }
      }
    },
    "whoopData": {
      "sleep": {
        "hours": "7:31",
        "qualityOrScore": "0.75"
      },
      "hrv": {
        "today": "52",
        "baseline": "58"
      },
      "restingHeartRate": {
        "today": "48",
        "baseline": "46"
      },
      "recoveryScore": "0.54",
      "moodOrStress": "normal"
    },
    "extensions": {}
  }
  